{
  "catalog_version": "1",
  "generated_at": "2026-10-04T10:33:29.707681+00:00",
  "drawio_source_version": "31.5.2",
  "source_fingerprints": {
    "app.asar:stencils/alibaba_cloud.xml": "6b61ad2b9f50ade888c05a7b4684b8afb35a0065887345114f0a173144a8dcb8",
    "app.asar:stencils/android/android.xml": "cb9f8c282258c5366f51ba3f6af50d325aba9b0d9ef8455d1fcbfb44cf0aa539",
    "app.asar:stencils/arrows.xml": "f946b037bd58809b9dcfb154e83d8a67d8714d678c9f7860436267593ea9cc35",
    "app.asar:stencils/atlassian.xml": "a0656b25e461e07c1a7016cb9d8a99a5448e6d4c43f1c64791a071ee39249e91",
    "app.asar:stencils/atlassian2.xml": "f464c25c4c84685019e1a753f5762fb15f4a9a85b9df4fcea16c72832bb4025e",
    "app.asar:stencils/aws/compute.xml": "65e7741a23a812dba5cf93fe3644a8dc480569d03b11fc8ec575f6ed2e53457c",
    "app.asar:stencils/aws/content_delivery.xml": "ae5604004bb0a046ba9ac3de348809f3b68c4d3d74c5f8b4d4da5aa8f2204b0f",
    "app.asar:stencils/aws/database.xml": "83a134d29c1b3decd8d0148f098fa77dfa87a34ce86c2dd1100fd690f7f75423",
    "app.asar:stencils/aws/deployment_management.xml": "e27605ea8028c1b497daa0639c7104255862afd39b9540c4c14fb94473021d12",
    "app.asar:stencils/aws/groups.xml": "a2b6de4fab128a5536aeff392ce03b1d5e4f44ff423bc12cd1974804bedcfac3",
    "app.asar:stencils/aws/messaging.xml": "ed2f887d9dc4a25a1657ba425a067709f137bb996691f9a6f78487b066350007",
    "app.asar:stencils/aws/misc.xml": "3f849030f2754a1bd14ed23a8943f7a706a8283c5cdfe8875a1c517fb77c78b8",
    "app.asar:stencils/aws/networking.xml": "d796098ab86b5260df10d5f91bcbdf940e9e8fe02cb7fbd73950715f21735b45",
    "app.asar:stencils/aws/non_service_specific.xml": "2df446f995c29ae1f8f7a7a37062d010f9969e416a245a4d71001ed1b6228b8c",
    "app.asar:stencils/aws/on_demand_workforce.xml": "de2a869905b5440c231278e58c5a950b4234c6a4f472495f72f4056c15df8b81",
    "app.asar:stencils/aws/storage.xml": "7d67c691a83e163771a7ea385da1410b0cb54154fb30270611b61d7750321617",
    "app.asar:stencils/aws2/administration_and_security.xml": "b61c157fb176b94950c8bf9f59aa31228c3ce8ccc704bdd053ea2ddf0e1fd368",
    "app.asar:stencils/aws2/analytics.xml": "1c9a98f294bfb1831e111bad12490fb85b35e70afbc2da2a5a817c8378dcefa3",
    "app.asar:stencils/aws2/app_services.xml": "e6f135ca04a6c782b44d5a1894e8a790687a6e7bfea442fc82811542085e53d7",
    "app.asar:stencils/aws2/compute_and_networking.xml": "0e1f61ff1769c25dfb70b4c69c4b6c96ec5db5657ea4a05157ee4ddd961bed44",
    "app.asar:stencils/aws2/database.xml": "953d87aeb6ace391f1914962672aec435559cf7e09eaf5682b524738c6813802",
    "app.asar:stencils/aws2/deployment_and_management.xml": "78927f813c6ada8f6c90d646bd55b63ef0b7fc8e48fc409354f33cd3165cc5d9",
    "app.asar:stencils/aws2/developer_tools.xml": "7ef7a33f9fc9d232dd5721a0218f7948ef1d528927b6cae1bf4b17f6ed1597a2",
    "app.asar:stencils/aws2/enterprise_applications.xml": "f7b3ca8d9ec663942b38596a5eeb9dc9d531f612c1d7af21cdf703d052409019",
    "app.asar:stencils/aws2/game_development.xml": "f076fbd520409831a5bb197f3dd4e9daa17feba4e05cf772a592df96db93d38b",
    "app.asar:stencils/aws2/internet_of_things.xml": "f1f121f2fab34b3ff6fe870fcce07d4d07edb1089733a5cc7b295c19d78fbe4a",
    "app.asar:stencils/aws2/management_tools.xml": "40b3cbd20c7444c68095a550c9b01e6a18c6687b57ea9d5aeaefcde74b55a6d5",
    "app.asar:stencils/aws2/mobile_services.xml": "eab19c2803dbd0ff8db7655dff423f5b248f4ae8853f03edff4d06551fc81bce",
    "app.asar:stencils/aws2/networking.xml": "a1f6bb882f243c6a9a2753affc653dec3ff76c11f41b8919cd1555e9f51b274b",
    "app.asar:stencils/aws2/non-service_specific.xml": "9f57a450881db1db557432e43c9cabd52d6bc85d8676d2cf5c11830bed3c6c57",
    "app.asar:stencils/aws2/on-demand_workforce.xml": "8f178140c760b92a8b16cd508664263ca65a29d1b27d5d50da15860624e4ba58",
    "app.asar:stencils/aws2/sdks.xml": "718d4b455ae48e99a52d9b59b6f2404c6133f270ed4ffb1675a117a03123f24d",
    "app.asar:stencils/aws2/security_and_identity.xml": "41c1785beaa5ff2394aadb46d6ac0ee87c5daa6f4d2a7fb0c4466618bc5750df",
    "app.asar:stencils/aws2/storage_and_content_delivery.xml": "0f33305e596741b68600499494405fb7d747766959fb6a1720e3e14d382ce7b3",
    "app.asar:stencils/aws3.xml": "dc3942b91c3f835d4b090b3d04218777c5481e5b81f3bd0b8c6cc9aae109286c",
    "app.asar:stencils/aws3d.xml": "7bf4f85b0654266df5ded4dc8a5f7d6dbd50d1421074b34955209518752674e6",
    "app.asar:stencils/aws4.xml": "d577382093fdff61d555efa6abe87136dd78746b7deb0bbb8d90876692010428",
    "app.asar:stencils/azure.xml": "664988a2ced3535855e6189eb3e0b7a782f1e72090441520945c24b9fb60840f",
    "app.asar:stencils/basic.xml": "5ef5d8a72540f0f2dd5b7cc94841b7d1f597f3d6859fd7e86d518ff5ba95aeab",
    "app.asar:stencils/bootstrap.xml": "ee0f49e5ec4b5f8cdcfe385c0f8b3a1f4b612c4c9ed64650a7af1c3786361f49",
    "app.asar:stencils/bpmn.xml": "cb2f6af5f87d74248f838ed9214278897d53a616be6be807b957a258b054525a",
    "app.asar:stencils/cabinets.xml": "570bd561a1023ead5f0e28ce869b83bfbb59587234fa1db67d1609b543383883",
    "app.asar:stencils/cisco/buildings.xml": "2840852c93ca360143e664616da4c2e9be05e15ed8dc3456511d635f412c9b45",
    "app.asar:stencils/cisco/computers_and_peripherals.xml": "56157eab7904b4831f6cfadb3c6ba62678a8e87620ed019c74896dda53843886",
    "app.asar:stencils/cisco/controllers_and_modules.xml": "3e01e1f807c7c731c1d45bd7092042937eb0995ecc112e5d615d9fe666f60369",
    "app.asar:stencils/cisco/directors.xml": "e882e6b70c093d239ff3bba6b6c17cdcd624b1e2e010d6f3fe86fcbe42c4111a",
    "app.asar:stencils/cisco/hubs_and_gateways.xml": "894e9588789da97a914c9a088d797e13d9e665f20017b49fe9363929ff9f04aa",
    "app.asar:stencils/cisco/misc.xml": "c6d98078d8aca320a7799b8c03e7e97093cfaa555645c84618e3f77fbc3f2f62",
    "app.asar:stencils/cisco/modems_and_phones.xml": "39a7c3586e35ca367a58f9e0440eb66564bd669efb875bf773fa0d4cfe1a189c",
    "app.asar:stencils/cisco/people.xml": "2a9168c92d3dcf4a040178c6ecf8168e682679134e9ecec6f19cb00cc82340e4",
    "app.asar:stencils/cisco/routers.xml": "88f494d8fa2eac680b7f1619c55af910b3ae95bdc0c322d9aa5bb8129707787f",
    "app.asar:stencils/cisco/security.xml": "538b6acc9af1c3bbd95d4bf00756383310022000e83108beba61526f8bb5f60d",
    "app.asar:stencils/cisco/servers.xml": "f783a91936faa010213e6b16b80bd7dbe7f551d14e56226219a4b955824ddf7b",
    "app.asar:stencils/cisco/storage.xml": "d98386bc96dfdd70c1babfacabac5b9bdf094e49e182bc8b99bf91007ec5f478",
    "app.asar:stencils/cisco/switches.xml": "a2e802b4c4398eec4eb493a54fabb0a03158860637964f8dcc7549d98912880d",
    "app.asar:stencils/cisco/wireless.xml": "b51e992e0cb388afb8d2539804767d083ae7751d20576cdfb0ea9abc34c2a9ce",
    "app.asar:stencils/cisco19.xml": "46cf8b86c5ad29880aa83d0c0388db90ee2794930e1d20bd5b8a6b157ad6d4a4",
    "app.asar:stencils/cisco_safe/architecture.xml": "8adc4a67b8dd54bfcc58915d563bb8543775dfddb6dfe11c3df98b0ee7e26d00",
    "app.asar:stencils/cisco_safe/business_icons.xml": "534d6556b701ac544cbcb3826702ef853d116efdd9cb7e41f5379a300448823f",
    "app.asar:stencils/cisco_safe/capability.xml": "840be38f6f1245ae4e3f90fb04512ce24a56cfd68d4ecd7d4a320a5ab4a149a8",
    "app.asar:stencils/cisco_safe/design.xml": "614ac293263c3978ff0a7b097f0597a0cf411616803097ed2165fad161e912c8",
    "app.asar:stencils/cisco_safe/iot_things_icons.xml": "2b24479eb24f6be541398c8b26cde98b56b07181bcc21aa38d42701b5933aafc",
    "app.asar:stencils/cisco_safe/people_places_things_icons.xml": "ff68c8a637f18772d199fa42585ac3a7272624d07f68af04416f649e3fb6fceb",
    "app.asar:stencils/cisco_safe/security_icons.xml": "fc4a85760c19819ee0534bb40ff8c2653a4dd41e50cd1781dfd5352cdafc2243",
    "app.asar:stencils/cisco_safe/technology_icons.xml": "15b846d5ec142ba90802dd466bddb83604f8722f22da71371c636104c5fb9882",
    "app.asar:stencils/cisco_safe/threat.xml": "fb0e126b27dff8e6aa9a6707ba42674a9c60528b1a742d4b69f28eb20cf4465d",
    "app.asar:stencils/citrix.xml": "50499fbc84b5626342144d7a9200b7d18c2dd5df3c4a2d7e11232542de1539a8",
    "app.asar:stencils/citrix2.xml": "c8dfac39343a581a3aab76641d86c22b9233808bbe9d5f994889cc220b920726",
    "app.asar:stencils/eip.xml": "46c715bebc5837a19097e0bfbd7706ecb05bf92dcfa9df7594dc4cfae0f77ff2",
    "app.asar:stencils/electrical/abstract.xml": "035eea087b2f339e791e0ca80f7b5f0b59edfc9f1d863588e788165fe8e110fd",
    "app.asar:stencils/electrical/capacitors.xml": "b9ce0dcf660e1ac58dd0ec984e3d396fe7b0770f5b86e47839580ca3f54836dc",
    "app.asar:stencils/electrical/diodes.xml": "bdc79a9c97461e6923407521a680117029c2bedf5e1f4c17b4474f332cdc9cde",
    "app.asar:stencils/electrical/electro-mechanical.xml": "50635ba184bb1c0e9d565a333a183d4c979de0518fb53bb17fbee1a33ba8829d",
    "app.asar:stencils/electrical/iec417.xml": "bf1af400c568e20accd73d5e08f29917380870804d869c06638d4f1231078eb6",
    "app.asar:stencils/electrical/iec_logic_gates.xml": "acca5609b92159ad4107e32a1065acfd8c09be9ac7d83543a1e2d2015682dd4b",
    "app.asar:stencils/electrical/inductors.xml": "b8ec48195103fc0ab4172afed205a2876081da95d7b95220f3d91a785d0e5b56",
    "app.asar:stencils/electrical/instruments.xml": "0975594d35ebc6d43ee99b1133a6e2543ea4f27afba450aa47ac115925df53ae",
    "app.asar:stencils/electrical/logic_gates.xml": "7c9a822a2213a792bdf6495292862779f8270c68d0759a25319973b4681421b8",
    "app.asar:stencils/electrical/miscellaneous.xml": "6a6b38612d90b07c5bca3d6f818d9ee161328fbfb193e73c68c1310cf01b0b12",
    "app.asar:stencils/electrical/mosfets1.xml": "f41c2c553ea3e4c08db3113cf968e1b3cf93ae3c0c156898dced82dc236fca35",
    "app.asar:stencils/electrical/mosfets2.xml": "059ab272d667a3e20974fdd538164f34bf92f992a3db1684c5a59c520e13ee81",
    "app.asar:stencils/electrical/op_amps.xml": "b7232c9d2a26bcab21960a5438de6819e8e6e19abd9abf7d73475082903751b0",
    "app.asar:stencils/electrical/opto_electronics.xml": "b2e239e57e86e5a4fb1352da87fa9c3e29c9223951b5320925c05b4e0d876563",
    "app.asar:stencils/electrical/plc_ladder.xml": "4a8c1146f4e4d984f23193783de4fa1f54a968cd36a012bfba787c7c09b95ede",
    "app.asar:stencils/electrical/power_semiconductors.xml": "6018bdf025acc136cd9381263811b7bfffeb1687ef2f13523c53d45a2225a6df",